<map xmlns="https://www.w3schools.com"
xmlns:xsi="http://www.w3.org/2001/XMLSchema-instance"
xsi:schemaLocation="https://www.w3schools.com story.xsd">
	<mapIntro>qwerty</mapIntro>
	<rooms>
		<room>
			<coordX>0</coordX>
			<coordY>0</coordY>
			<shortDescription>Ah</shortDescription>
			<longDescription>Aaaah</longDescription>
			<roamable>false</roamable>
			<items>
				<weapon>
					<name>Sword</name>
					<shortDescription>Hm</shortDescription>
					<longDescription>Hmmmmmm</longDescription>
					<damage>10</damage>
					<piercing>0</piercing>
					<slot>WEAPON</slot>
				</weapon>
				<armor>
					<name>Helm</name>
					<shortDescription>No</shortDescription>
					<longDescription>Nooooooo</longDescription>
					<reduction>15</reduction>
					<slot>HEAD</slot>
				</armor>
				<armor>
					<name>Steel Plate Armor</name>
					<shortDescription>Grr</shortDescription>
					<longDescription>Grrrrrr</longDescription>
					<reduction>35</reduction>
					<slot>TORSO</slot>
				</armor>
				<armor>
					<name>Leather Chaps</name>
					<shortDescription>Lol</shortDescription>
					<longDescription>Loooool</longDescription>
					<reduction>10</reduction>
					<slot>LEGS</slot>
				</armor>
				<armor>
					<name>Mittens</name>
					<shortDescription>Mittens</shortDescription>
					<longDescription>No, that's not the name of a cat. They're actual mittens, dimwit.</longDescription>
					<reduction>5</reduction>
					<slot>HANDS</slot>
				</armor>
				<armor>
					<name>Uggs</name>
					<shortDescription>Ugh</shortDescription>
					<longDescription>Uuuuuugh</longDescription>
					<reduction>0</reduction>
					<slot>FEET</slot>
				</armor>
				<useItem>
					<id>Key1</id>
					<shortDescription>asdf</shortDescription>
					<longDescription>asdfghjkl</longDescription>
					<name>New Key</name>
					<matchingIds>
						<matchingId>Chest1</matchingId>
					</matchingIds>
				</useItem>
			</items>
			<objects>
				<object>
					<name>Chest</name>
					<id>Chest1</id>
					<requiresItem>true</requiresItem>
					<activated>false</activated>
					<description>A chest.</description>
					<activationEvent>
						<type>ITEMDROP</type>
						<droppedItems>
							<useItem>
								<id>Key2</id>
								<shortDescription>Why</shortDescription>
								<longDescription>Why did I make every single item need a description?</longDescription>
								<name>Old Key</name>
								<matchingIds>
									<matchingId>Door1</matchingId>
								</matchingIds>
							</useItem>
						</droppedItems>
					</activationEvent>
				</object>
				<object>
					<name>Chair</name>
					<id>Chair</id>
					<requiresItem>false</requiresItem>
					<activated>false</activated>
					<activationEvent>
						<type>DIALOGUE</type>
						<eventDialogue>
							<context>EVENT</context>
							<text>You sit down. The chair breaks.</text>
						</eventDialogue>
					</activationEvent>
				</object>
			</objects>
			<exits>
				<exit>
					<id>Door1</id>
					<position>TOP</position>
					<blocked>false</blocked>
					<locked>true</locked>
					<events>
						<event>
							<type>UNLOCK</type>
							<eventDialogue>
								<context>EVENT</context>
								<text>You unlock the door.</text>
							</eventDialogue>
						</event>
					</events>
				</exit>
				<exit>
					<id>Door2</id>
					<position>BOTTOM</position>
					<blocked>true</blocked>
					<locked>false</locked>
					<events>
						<event>
							<type>UNBLOCK</type>
							<eventDialogue>
								<context>EVENT</context>
								<text>You remove the rubble from in front of the door.</text>
							</eventDialogue>
						</event>
					</events>
				</exit>
				<exit>
					<id>Door3</id>
					<position>RIGHT</position>
					<blocked>false</blocked>
					<locked>false</locked>
				</exit>
			</exits>
		</room>
	</rooms>
	<characters>
		<player>
			<id>player</id>
			<health>100</health>
			<maxHealth>100</maxHealth>
			<baseDamage>5</baseDamage>
			<positionX>0</positionX>
			<positionY>0</positionY>
			<savedGame>false</savedGame>
			<heldItems>
				<weapon>
					<name>Rapier</name>
					<shortDescription>Brr</shortDescription>
					<longDescription>Brrrrrr</longDescription>
					<damage>5</damage>
					<piercing>5</piercing>
					<slot>WEAPON</slot>
				</weapon>
				<healingItem>
					<name>Potion</name>
					<shortDescription>Rr</shortDescription>
					<longDescription>Rrrrrr</longDescription>
					<boost>false</boost>
					<uses>2</uses>
					<amountHealed>25</amountHealed>
				</healingItem>
			</heldItems>
			<equippedItems>
				<weapon>
					<name>Sword</name>
					<shortDescription>Hm</shortDescription>
					<longDescription>Hmmmmmm</longDescription>
					<damage>10</damage>
					<piercing>0</piercing>
					<slot>WEAPON</slot>
				</weapon>
				<armor>
					<name>Helm</name>
					<shortDescription>No</shortDescription>
					<longDescription>Nooooooo</longDescription>
					<reduction>15</reduction>
					<slot>HEAD</slot>
				</armor>
				<armor>
					<name>Steel Plate Armor</name>
					<shortDescription>Grr</shortDescription>
					<longDescription>Grrrrrr</longDescription>
					<reduction>35</reduction>
					<slot>TORSO</slot>
				</armor>
				<armor>
					<name>Leather Chaps</name>
					<shortDescription>Lol</shortDescription>
					<longDescription>Loooool</longDescription>
					<reduction>10</reduction>
					<slot>LEGS</slot>
				</armor>
			</equippedItems>
		</player>
		<npc>
			<name>Grue</name>
			<id>Grue1</id>
			<health>25</health>
			<maxHealth>25</maxHealth>
			<baseArmor>5</baseArmor>
			<baseDamage>10</baseDamage>
			<hostile>true</hostile>
			<shortDescription>A grue.</shortDescription>
			<longDescription>A grue. They tend to like dark places.</longDescription>
			<positionX>0</positionX>
			<positionY>0</positionY>
			<roaming>false</roaming>
			<heldItems>
				<armor>
					<name>Mittens</name>
					<shortDescription>Mittens</shortDescription>
					<longDescription>No, that's not the name of a cat. They're actual mittens, dimwit.</longDescription>
					<reduction>5</reduction>
					<slot>HANDS</slot>
				</armor>
			</heldItems>
			<equippedItems>
				<armor>
					<name>Uggs</name>
					<shortDescription>Ugh</shortDescription>
					<longDescription>Uuuuuugh</longDescription>
					<reduction>0</reduction>
					<slot>FEET</slot>
				</armor>
			</equippedItems>
		</npc>
		<npc>
			<name>Goblin</name>
			<id>Goblin1</id>
			<health>10</health>
			<maxHealth>10</maxHealth>
			<baseArmor>0</baseArmor>
			<baseDamage>5</baseDamage>
			<hostile>true</hostile>
			<shortDescription>A goblin.</shortDescription>
			<longDescription>A goblin. The weakest of monsters.</longDescription>
			<positionX>0</positionX>
			<positionY>0</positionY>
			<roaming>true</roaming>
		</npc>
		<npc>
			<name>Farmer</name>
			<id>Farmer1</id>
			<health>10</health>
			<maxHealth>10</maxHealth>
			<baseArmor>0</baseArmor>
			<baseDamage>5</baseDamage>
			<hostile>false</hostile>
			<shortDescription>A farmer.</shortDescription>
			<longDescription>A farmer. Not sure what he's doing here.</longDescription>
			<positionX>0</positionX>
			<positionY>0</positionY>
			<roaming>false</roaming>
			<dialogueLines>
				<dialogueLine>
					<context>TALK</context>
					<text>Howdy there.</text>
				</dialogueLine>
				<dialogueLine>
					<context>KILL</context>
					<text>Why'd ya have ta go and fight me? I didn't want ta hurt ya.</text>
				</dialogueLine>
				<dialogueLine>
					<context>DEATH</context>
					<text>*gurgle*</text>
				</dialogueLine>
				<dialogueLine>
					<context>TALK</context>
					<text>Top of the mornin' to ya.</text>
				</dialogueLine>
			</dialogueLines>
		</npc>
	</characters>
</map>