<map xmlns="https://www.w3schools.com"
xmlns:xsi="http://www.w3.org/2001/XMLSchema-instance"
xsi:schemaLocation="https://www.w3schools.com story.xsd">
	<mapIntro>asdf</mapIntro>
	<rooms>
		<room>
			<coordX>0</coordX>
			<coordY>0</coordY>
			<items>
				<weapon>
					<name>Sword</name>
					<shortDescription>A sword</shortDescription>
					<longDescription>A shiny new sword. Pretty basic.</longDescription>
					<slot>WEAPON</slot>
					<damage>10</damage>
					<piercing>0</piercing>
				</weapon>
			</items>
			<roamable>false</roamable>
			<shortDescription>A room with no way out</shortDescription>
			<longDescription>A plain white room with one chair and no way out.</longDescription>
			<objects>
				<object>
					<id>chair</id>
					<description>a plain brown wooden chair</description>
					<activated>false</activated>
					<requiresItem>false</requiresItem>
					<activationEvent>
						<type>END</type>
						<eventDialogue>
							<context>EVENT</context>
							<text>You sit in the chair and wait for all eternity. The End.</text>
						</eventDialogue>
					</activationEvent>
				</object>
			</objects>
			<exits>
				<exit>
					<id>wall1</id>
					<position>TOP</position>
					<blocked>true</blocked>
					<locked>false</locked>
				</exit>
			</exits>
		</room>
	</rooms>
	<characters>
		<player>
			<id>player</id>
			<health>100</health>
			<baseDamage>1</baseDamage>
			<equippedItems>
				<weapon>
					<name>Fisticuffs</name>
					<shortDescription>Your fists.</shortDescription>
					<longDescription>Fisticuffs. A brutish weapon for a less civilized age.</longDescription>
					<slot>WEAPON</slot>
					<damage>2</damage>
					<piercing>0</piercing>
				</weapon>
				<armor>
					<name>Helm of the Ancients</name>
					<shortDescription>An ancient helmet.</shortDescription>
					<longDescription>An old, rusty, broken helmet. Just because it's ancient doesn't mean it's good.</longDescription>
					<slot>HEAD</slot>
					<reduction>5</reduction>
				</armor>
			</equippedItems>
			<heldItems>
				<healingItem>
					<name>Health Potion</name>
					<shortDescription>A health potion.</shortDescription>
					<longDescription>Restores 20 health.</longDescription>
					<amountHealed>20</amountHealed>
					<uses>3</uses>
					<boost>false</boost>
				</healingItem>
				<useItem>
					<name>A key</name>
					<shortDescription>A rusty key.</shortDescription>
					<longDescription>An old rusty key. It might fit something, but it looks like it's about to break.</longDescription>
					<id>key1</id>
					<matchingIds>
						<matchingId>door1</matchingId>
					</matchingIds>
				</useItem>
			</heldItems>
			<positionX>0</positionX>
			<positionY>0</positionY>
			<savedGame>false</savedGame>
		</player>
	</characters>
</map>